id,phone,title,review,source,score
1403,"iphone 15","Worth every penny","Just go for itAmazing oneBeautiful camera with super fast processor",flipkart,1
1404,"iphone 15","Good choice","Very nice",flipkart,1
1405,"iphone 15","Mindblowing purchase","High quality camera",flipkart,0
1406,"iphone 15","Just wow","Camera Quality Is Improved Loving It",flipkart,1
1407,"iphone 15","Worth every penny","Just loved the product colour design is wow and camera is amazing just clicked first picture of my grandmother in portrait mode and results r here in front of you guys ",flipkart,1
1408,"iphone 15","Worth every penny","Awesome photography experience Battery backup is good Display is much better than 14 version",flipkart,1
1409,"iphone 15","Worth the money","Best mobile phoneCamera quality is very nice Battery backup is very good Sound quality is amazing",flipkart,1
1410,"iphone 15",Awesome,"Switch from OnePlus to iPhone I am stunned with camera performance Everything is perfect on iPhone 15",flipkart,1
1411,"iphone 15",Brilliant,"Totally happyCamera 5Battery 5 Display 5Design 5",flipkart,0
1412,"iphone 15","Classy product","Nice ",flipkart,1
1413,"iphone 15",Excellent,"Awesome product very happy to hold this Better In hand feelmatte finish Good camera Brighter screen with Dynamic Island USBC great battery life60Hz display is a dealbreaker for someIts not much noticeableThank u Flipkart for the best deal and quick delive",flipkart,1
1414,"iphone 15","Highly recommended","I love this phone The camera is amazing its I am so happy",flipkart,1
1415,"iphone 15","Worth every penny",Great,flipkart,1
1416,"iphone 15",Awesome,"Simply premium",flipkart,0
1417,"iphone 15",Super,"A Perfect Smartphone ",flipkart,1
1418,"iphone 15","Simply awesome","for me its 10 out of 10",flipkart,0
1419,"iphone 15","Just wow","Awesome ",flipkart,1
1420,"iphone 15","Great product","best camera and battery is also very good In love with dynamic Island Typec charging is very fast Overall best phone",flipkart,1
1421,"iphone 15","Really Nice","Awesome camra quality superb camra ",flipkart,1
1422,"iphone 15",Wonderful,"Nice product",flipkart,1
1423,"iphone 15","Best in the market","Simply Awesome ",flipkart,1
1424,"iphone 15","Classy product","Camera is just wow All classes clicks are done at nightphone Performance is awesome Im writing now again for reviewits really maintained its premium image",flipkart,1
1425,"iphone 15","Simply awesome","This is my first iphone ever used loving it already this is worth it ",flipkart,1
1426,"iphone 15",Awesome,"Nice ",flipkart,1
1427,"iphone 15","Must buy","Using this Iphone 15 from 1month and it has best Camera",flipkart,1
1428,"iphone 15",Terrific,"Their is nothing to explain about Apple iPhone nowadays everyone knows when ur comes to iPhone 15 is just amazing ",flipkart,1
1429,"iphone 15","Mindblowing purchase","The iPhone 15 exceeded my expectations in every way possible The sleek design stunning display and lightningfast performance make it a standout device in the smartphone market The camera quality is unparalleled capturing every moment with incredible detai",flipkart,1
1430,"iphone 15","Great product","Awesome phone powerful performance and battery backup are also very good no heating issue ",flipkart,1
1431,"iphone 15",Valueformoney,"Nice phone good",flipkart,1
1432,"iphone 15","Classy product","Awesome quality I am very happy Thank you Flipkart",flipkart,1
1433,"iphone 15",Brilliant,"moving from android to apple is a surreal experience still apple could focus on more flexibility towards the apps",flipkart,1
1434,"iphone 15","Just wow","Camera ",flipkart,0
1435,"iphone 15","Just wow","Thanks Flipkart I m glad such a beautiful iPhone 15",flipkart,1
1436,"iphone 15","Best in the market","48 megapixel is litThin bessels compared to 14Lesser in weightDynamic Island works perfectlyGood battery backup My rating 55",flipkart,0
1437,"iphone 15",Wonderful,"Simply wow wow wow ",flipkart,1
1438,"iphone 15",Fabulous,"It looks so good in my hand WAU",flipkart,1
1439,"iphone 15",Fabulous,"Its performance is super and nice camera also a ok battery backup",flipkart,1
1440,"iphone 15","Classy product","Absolutely premium productjust wow",flipkart,1
1441,"iphone 15","Classy product","A perfect n balanced phone Was thinking of switching to ios from last two years and yeah its worth buying the black beauty ",flipkart,1
1442,"samsung s24 5G",Awesome,"Completely satisfied with purchase",flipkart,1
1443,"samsung s24 5G","Perfect product","Mind Blowing phone go for it great performance camera is amazing you can look the shot with AI generation background was totally cleared from the crowd just go for it better than Iphone 15",flipkart,1
1444,"samsung s24 5G",Terrific,"Fulfilled my expectationsThe Stunning Design Display new One UI 61 new AI are the highlights of itHowever Flipkart service is worstPart of prebooking offer they are supposed to providefree wireless charge but not provided I dont recommend Flipkart",flipkart,1
1445,"samsung s24 5G","Pretty good","Nice compact phone with great display and camera Cons are heating and battery performance",flipkart,1
1446,"samsung s24 5G","Good choice","Review after 1 month usingHeating issueCamera goodBattery decent Charging fastLook is goodPerformance is goodOverall good product",flipkart,1
1447,"samsung s24 5G",Brilliant,"CompactGreat Camera Best Display and Design Good Performance and Battery This phone is for Casual Users who wants to use phone for 57 years Compact is the word for this phonePoint to be noted This phone is not for Hardcore Gamers",flipkart,1
1448,"samsung s24 5G","Classy product","Writing review after 2 weeks of using s241 Camera 552 Performance 553 Battery backup 3554 Display 555 Display 455",flipkart,0
1449,"samsung s24 5G","Pretty good","Liked the product As expected from a Samsung device it has a brilliant display and camera The performance is great too Phone is fast and snappy What I didnt like is the battery performance Its fairly decent My 3 yr old OnePlus 9R was giving similar batter",flipkart,1
1450,"samsung s24 5G",Terrific,"Nice product AI new feature awesome",flipkart,1
1451,"samsung s24 5G",Super,"Using it for 2 days looks 1010Screen 1010Battery 710Camera 710",flipkart,0
1452,"samsung s24 5G","Mindblowing purchase","Wonderful productCamera 1010Battery 910Performance 9510Overall design 1010Display 1010Must buy it",flipkart,1
1453,"samsung s24 5G","Good choice",Good,flipkart,1
1454,"samsung s24 5G","Classy product","Great in hand experience",flipkart,1
1455,"samsung s24 5G",Delightful,"I am not happy with battery performance I spend 70k for this phone and everything that a premium phone can perform it did on top but battery life just ruined everything",flipkart,-1
1456,"samsung s24 5G","Mindblowing purchase","No phone is perfect but it is better than any other flagship Even From iPhone base variant",flipkart,1
1457,"samsung s24 5G",Fabulous,"After a threemonth of using and evaluation the camera and display performance are commendable The battery capacity is satisfactory with a combination of CPU from Exynos 2400 and GPU from AMD Super Fast It is advised to refrain from using cheap inbuilt mag",flipkart,1
1458,"samsung s24 5G",Excellent,"Samsung Galaxy S24 is an outstanding smartphone that impresses with its AI advanced features and sleek design From the moment I picked it up I could feel the premium quality of the materials and the attention to detail in every aspect of the deviceThe scr",flipkart,1
1459,"samsung s24 5G","Just wow","Heating issue while using camera and banking app ",flipkart,0
1460,"samsung s24 5G","Simply awesome","The phone is tremendous except 3 issues1 Signal is low and internet connection is slow No call drop but a lot of buffering But when in correct signal range of 5G downloads are super quick2 Sometimes found to have incorrect accidental touches3 App drawer i",flipkart,1
1461,"samsung s24 5G","Terrific purchase","Best phone in this price even I compared camera quality with I phone 15 plus and google pixel 7 pro and I phone 15 plus is getting 3rd no in all 3 phones So guyzz winner is here samsung s24 gray colour go for it without any doubt",flipkart,1
1462,"samsung s24 5G","Mindblowing purchase","If you want to purchase a camera phone then this would be the best option for you Absolutely loved the pictures clicked on this phone Also the display and the design is very awesome",flipkart,1
1463,"samsung s24 5G","Just wow","Camera quality is excellent Overall experience was good",flipkart,1
1464,"samsung s24 5G","Pretty good",Nice,flipkart,1
1465,"samsung s24 5G",Excellent,"Nice phone better than iphone 15",flipkart,1
1466,"samsung s24 5G",Awesome,"It feels better than iphone 15",flipkart,1
1467,"samsung s24 5G","Best in the market","Very bright and good display speakers are loud performance and camera is awesome I love the telephoto lens its soo good Im coming from iPhone and this is the perfect product Battery life max 430 hrs 5hrs SOT Sometimes the phone do get warm by doing simple",flipkart,1
1468,"samsung s24 5G",Fabulous,"Ive been using the this mobile for the past 20 days and I must say its been a delightful experience overall Lets dive into the detailsDesign The S24 exudes a premium aura with its sleek design and compact form factor It strikes the perfect balance between",flipkart,1
1469,"samsung s24 5G",Wonderful,"Superb CameraBest Mobile",flipkart,1
1470,"samsung s24 5G","Worth the money","Phone is good in terms of performance but heating a lot for basic use itself Camara options need to be improved and battery performanceoptimization also has to be improved Software optimization for chipset has to be made",flipkart,1
1471,"samsung s24 5G","Best in the market","Absolutely love the S24 compact phone easy to hold on camera is awesome performance is good display is great but battery could have been little more overall the phone is great to use and can suggest that you can buy this device ",flipkart,1
1472,"samsung s24 5G","Very Good","The phone is compact and performance is powerful Good camera The major miss seems to be the battery drain and the phone heats up but cools down well Clearly needs improvement in battery optimization",flipkart,1
1473,"samsung s24 5G",Terrific,"its better then iphone 15 Cause in s24 have so much better features then 15",flipkart,1
1474,"samsung s24 5G","Good quality product","Owasm Product quantity camera feel perfume featuresButBattery drain high in normal usesI feel heating lightly",flipkart,0
1475,"samsung s24 5G",Excellent,"Everything is perfect except battery",flipkart,1
1476,"samsung s24 5G",Brilliant,"Very good product",flipkart,1
1477,"samsung s24 5G",Excellent,"I upgraded from S21 to S24 The design of the Phone is stunning and It also has an awesome display Camera is good Overall Its a great Phone Will be posting an in depth review after using it for couple of days",flipkart,1
1478,"samsung s24 5G","Decent product","Phone form factor and camera are excellent Major drawbacks are the heating issue when using camera and the faster battery drain These may be attributed to the Samsungs Exynos processors inferior performance Potential buyers of this phone can buy the S23 i",flipkart,1
1479,"samsung s24 5G","Just okay","doesnt feel like a samsung screen heating signal quality too poor first high value flagship purchase turns a disappointment for me",flipkart,-1
1480,"samsung s24 5G",Valueformoney,"Best phone but need some speed charging support",flipkart,1
1481,"samsung s24 5G","Must buy","Good product",flipkart,1
1482,"oneplus 12","Just wow","Superb mobile osm camera result very fast work mobile and very smooth touch over all mobile superb",flipkart,1
1483,"oneplus 12","Just wow","One plus excellent camera quality thank q Flipkart fast deliveryfast display working",flipkart,1
1484,"oneplus 12","Simply awesome","Thank you For super Fast delivery Product Quality Excellent",flipkart,1
1485,"oneplus 12","Classy product","Super Flagship phone under budget",flipkart,1
1486,"oneplus 12","Must buy","Excellent Perfect Screen Resolution with Perfect Haptics Touch response and experience till now after using this device for a month feels great like new everytimeCamera Performance and Image Processing is the best amongst any Android phone till date And O",flipkart,1
1487,"oneplus 12","Worth every penny","Outstanding Camera ",flipkart,1
1488,"oneplus 12","Terrific purchase","The phone is best but I did not know that it does not have e sim which is more needed as I am sailor Kindly suggest me what to do If I can exchange this phone it will be good",flipkart,1
1489,"oneplus 12","Perfect product","Previous I have been use one plus 6t 6years in the period of time ni hanging no repairsone plus is world no 1 flagship brand this 12 version super in 16 GB Ram camera marvelous Sony quality no heat during charging superbMobile",flipkart,1
1490,"oneplus 12","Classy product","Beast in every segment At first I was thinking of purchasing Samsung Galaxy S23 Ultra but then saw this perfect hand held machine for routine tasksUndoubtedly the best in market currently",flipkart,1
1491,"oneplus 12",Excellent,"Superb camera clarity super fast performance",flipkart,1
1492,"oneplus 12",Good,"1camera is good for photos but when u want to take 120x zoom then photos will get totally blurred no nothing clarity 2mobile is smooth and good3 After 2 security updates the mobile is a little bit hot4no e sim for 70000 mobile 5Mobile slightly getting hea",flipkart,1
1493,"oneplus 12","Great product","I am satisfied with build quality and camera quality as well as great performance and felt little bit expensive but okay good one as it has reverse and wireless charging and 100 battery will lost almost up to 24 hours of normal usage",flipkart,1
1494,"oneplus 12",Wonderful,"Super se upper no one can beat this mobile after 1 month I have given review the beasteverything is wow",flipkart,1
1495,"oneplus 12","Unleashing Excellence The OnePlus 12 Performance Review","The Oneplus 12 epitomizes smartphone innovation boasting a sleek desig powerful performance driven by the latest snapdragon 8 gen 3 processor and vibrant AMOLED displayIts advanced camera system captures stunning photos and videos in any setting with oxyg",flipkart,1
1496,"oneplus 12",Awesome,"VERY GOOD I LOVE THIS PHONE JUST BATTERY DRAINS LIKE 5000MAH PHONE AND HEATS UP A LITTLE EXCLUDING THIS THE PHONE IS BEAST",flipkart,1
1497,"oneplus 12",Terrific,"Awesome Best of all segment Value of money purchase 16 GB RAM",flipkart,1
1498,"oneplus 12","Classy product","I love it Awesome mobile and premium quality",flipkart,1
1499,"oneplus 12","Simply awesome","Very nice",flipkart,1
1500,"oneplus 12","Must buy","Nice phone love this one",flipkart,1
1501,"oneplus 12","Simply awesome","Overall Good",flipkart,1
1502,"oneplus 12",Excellent,"If you compare with Samsung s21 ultra and above camera than its lower side ultra series camera is much better Other than that everything is great",flipkart,1
1503,"oneplus 12","Must buy","Awesome Phone Loved it camera display UAI everything is 5 Star Getting the best deal on Flipkart Thank you ",flipkart,1
1504,"oneplus 12","Worth every penny",Super,flipkart,1
1505,"oneplus 12","Perfect product","Worth the buy Getting all the flagship features of S 24 ultra at half a price",flipkart,1
1506,"oneplus 12",Wonderful,"I dont have a single word for this productBecause I cant praise it enough it is a really excellent productI it",flipkart,1
1507,"oneplus 12","Simply awesome","After using it for a month i would say just go for it If your budget is 5070k then definitely it is a beast in this prize rangeI am giving rating out of 10Camera 9 compare with iphone and samsung ultra series also zoom is not clear as iqoo12 that is why i",flipkart,1
1508,"oneplus 12",Excellent,"One of my best purchase so farThe phone is performing beyond expectations and despite being so powerful and full of features the battery backup is outstanding it easily gives me 1and half days with continuous calling wifi and 5g on and video playback of 3",flipkart,1
1509,"oneplus 12",Terrific,"Very good",flipkart,1
1510,"oneplus 12","Must buy","Ive been using the OnePlus 12 for a month now and Im blown away by its performance The phone is incredibly fast thanks to the Qualcomm Snapdragon 8 Gen 3 processor The 16GB of RAM ensures seamless multitasking and the 120Hz AMOLED display with 2k resoluti",flipkart,1
1511,"oneplus 12","Simply awesome","Best product but I hate delivery person",flipkart,-1
1512,"oneplus 12","Great product","Xlnt features all r ok till",flipkart,1
1513,"oneplus 12","Best in the market","Mindblowing and fantastic device by OnePlus",flipkart,1
1514,"oneplus 12",Excellent,"Awesome Phone",flipkart,1
1515,"oneplus 12",Super,"Thrilled with my recent online purchase of the OnePlus 12 This phone is fantastic sleek design impressive performance immersive display and amazing camera quality Battery life is solid too Highly recommend this phone for anyone looking for a great flagshi",flipkart,1
1516,"oneplus 12","Best in the market",Good,flipkart,1
1517,"oneplus 12","Worth every penny","Nice ",flipkart,1
1518,"oneplus 12","Great product","Wonderful device for the price OnePlus has stepped up their game with this one",flipkart,1
1519,"oneplus 12","Worth every penny","All is best camera display battery etc I am so happy for perched this one plus12 phone Thanks flipkart",flipkart,1
1520,"oneplus 12","Worth every penny","Excellent product One plus is awesome ",flipkart,1
1521,"oneplus 12",Terrific,"Buttery smooth value for money ",flipkart,1
1522,"pixel 8","Just wow","Almost impossible to take a bad shot with this phone Completely loved it ",flipkart,1
1523,"pixel 8",Wonderful,"Love it so much I think Design is better than other phoneOnly needed camera pro mode",flipkart,1
1524,"pixel 8","Just wow","Good cameraAI features editor amazing",flipkart,1
1525,"pixel 8",Brilliant,"I have been using the Pixel 8 for 2 months Here is my experience so far Ill divide the review in Pros and consPro1 Camera So far this is the proper point and shoot camera Just open the camera click pictures and they will turn out to be great Compared to S",flipkart,1
1526,"pixel 8",Brilliant,"I recently upgraded from iPhone 14 to Google Pixel 8 And its worth every pennyDont hesitate and just go for it without any second thought",flipkart,-1
1527,"pixel 8","Pretty good","My first device has damaged and then I got a complete replacement through F1 info solutions Its been a month of usage Im facing serious heating issues and battery draining Afterall its beast especially for camera vibration motor crispy displayoverall phen",flipkart,-1
1528,"pixel 8","Worth the money","Probably the best android phone in terms of user expirienceLots of things to learncamera captures real photosOnly issue is phone heating on the side aluminium panel which is really annoying considering its winter in indiaI will post another review in a mo",flipkart,1
1529,"pixel 8","Must buy","I got it yesterday There is a difference between warm and hot It feels warm when gaming not heat and its slightly more warmer during charging than gamingThis is my true experience in one day whole usage Kindly dont believe others complaining they are just",flipkart,1
1530,"pixel 8","Terrific purchase","Very premium looking and compact Good camera and filled with amazing ai features Overall very balanced phone",flipkart,1
1531,"pixel 8",Valueformoney,"Whoever is thinking bout buying the phone right now stop If you aint getting any good offers or you are not a pixel fan then there is no point in buying this phone at this priceProsCameras like every other youtuber is saying bout this phones cameras its t",flipkart,1
1532,"pixel 8","Nice product","Initial impressions its been about three days since I got the phoneThe phone looks and feels GREAT Better in real life than in pictures even the official pictures put up by Google Definitely an eyeturner in a market full of samsungs and apples The camera ",flipkart,1
1533,"pixel 8",Excellent,"What youll like Great pics no matter what the lighting Came here from an S22 Ultra Unlike that the P8 naturally knows when and how to take the perfect contrasty pic IDK how Best take feature is a must have Boon if you have kids or take a lot of group pics",flipkart,1
1534,"pixel 8",Fabulous,"Perfect size phone for a compact phone user Hazel color looks amazingIt has the best display on a phone in the worldcheck DXOMark ratingThe phone is quick and the touch is amazingBattery life is decent considering display quality and the brightness Im yes",flipkart,1
1535,"pixel 8","Worth the money","Overall its a good premium stock Android phoneBattery heats up when exposed in the direct sun sometimes and slows down the charging speedOtherwise its a smooth and top notch phone as you expect from a Pixel device",flipkart,1
1536,"pixel 8","Classy product","Nice performance of camera Good Software experience Battery performance also good for the full day",flipkart,1
1537,"pixel 8","Highly recommended","One of the best cameras you can get on Android phones",flipkart,1
1538,"pixel 8","Perfect product","The phone is excellent No heating but it does get ever so slightly warm but no where close to how hot tensor G1 and G2 gotperformance is top notch Haptic on this phone is ultimate its way better than any other phone including iphones Display is beautiful ",flipkart,1
1539,"pixel 8","Highly recommended","Must buy amazing phonecamera quality awesomein hand feel also awesome just go for it",flipkart,1
1540,"pixel 8","Must buy","feel premiumdisplaycamera and biuld quality superbheats little bit if u use continuously",flipkart,0
1541,"pixel 8","Mindblowing purchase","Camera 1010User Experience 1010Display 1010Performance 1010 No issues so far120Hz display feels so much better",flipkart,1
1542,"pixel 8","Classy product","Just looking like a worth",flipkart,1
1543,"pixel 8",Fabulous,"Updated from Pixel 6a to Pixel 8 Superb deal during the big billion days Battery backup could have been better camera no doubt is great performance display are awesome Overall a great product",flipkart,1
1544,"pixel 8","Mindblowing purchase","Just perfect phone Dont go with negative ratings Phone is so good for normal usage No heating issue so far If you feel battery draining fast then disable digital wellbeing app through Android debloater",flipkart,1
1545,"pixel 8","Highly recommended","Much better than My older pixel 7Really licked pixel 8 a lot",flipkart,1
1546,"pixel 8","Terrific purchase","Camera is very excellent smoothly working 1012 hour battery backup on screen",flipkart,1
1547,"pixel 8","Mindblowing purchase","People looking to buy a premium phone with a limited budget should definitely lay hand on this oneI was a bit sceptical on buying this product but once when I started using this I was amazedPros1 The camera is top notch even amateur photographers will cli",flipkart,1
1548,"pixel 8","Best in the market","Well I got it is with exchange of my old phone Have been using OnePlus devices from last siz years This phone has been working fine for me from last 15 days I saw people talking about battery period I found it similar to previous phone Full charge giving ",flipkart,1
1549,"pixel 8","Must buy","brilliant colorbrilliant phone",flipkart,1
1550,"pixel 8","Perfect product","Ill update this review once my phone receives 1 or 2 updates because the heating issues are pretty bad",flipkart,-1
1551,"pixel 8",Terrific,"Pixel is King",flipkart,0
1552,"pixel 8","Really Nice","I was in deep dilemma for which phone to buy between I phones Samsungs and One Plus But somehow have not heard great things about One Plus lately so stuck to top 3 Of that I wanted to stick to Android as Apple is needlessly exclusive So ended up with Sams",flipkart,1
1553,"pixel 8","Really Nice","Phone gets warm during basic tasks battery life is also not that great imoUpdate most issues fixed after software update",flipkart,-1
1554,"pixel 8","Simply awesome","Amazing Phone from Google Perfect size Nice colour All good",flipkart,1
1555,"pixel 8","Worth every penny","Using pixel 8 256gb from past one month its very smooth and cool But the battery wont last more and Not suitable for gamingSuperb camera qualityDesign wise looking decent and immersive",flipkart,1
1556,"pixel 8",Wonderful,"Camera is Great no heating issuefeels so fast due to various optimization and battery last whole day if screen time is not so much Fully loaded with features Worth it",flipkart,1
1557,"pixel 8",Super,"Overall a classy product",flipkart,1
1558,"pixel 8","Perfect product","Just one word Awesome",flipkart,1
1559,"pixel 8",Brilliant,"The pixel ever used1 Camera 10 10 the biggest Samsung sensors ever which is GN22 Display 1010 crisp and 120 hz is fantastic3 Design 1010 Compact and not able to believe that everything is there4 Battery 910 Decent battery",flipkart,0
1560,"pixel 8","Must buy","This is my first time purchasing a Pixel after previously using the Samsung S23 and iPhone 14 I was getting bored with both the brands operating systems so I decided to try something differentI was initially hesitant about buying the Pixel 8 having heard ",flipkart,1
1561,"pixel 8",Fabulous,"An absolute banger of a product by Google I chose this over the iPhone 15 and S24 and my oh my I was right Theres no way Im going back to a mid range or cheap phone like the Oppos or Redmi again Not like Ill have to ever the longevity of Google is enough ",flipkart,1
1562,"Iphone 15","seeking advice on what model used iPhone to get","Well it finally happened I dropped my SE 2020 and it hit the pavement perfectly flat with a sickening sound Not just cracked part of the glass is just gone So Money is tight The are only two things that Id hope to improve 1 Using Siri for navigation Its f",reddit,1
