id,phone,title,review,source,score
1563,"Iphone 15","Best External SSD Compatible with iPhone 15 for Photography and File Transfers in India","Hi all Im looking for an external SSD that works well with the iPhone 15 specifically for photography storage and smooth file exchange Im hoping to find a reliable SSD to quickly back up photos store highresolution images and transfer files between device",reddit,1
1564,"Iphone 15","My iphone 15 is having issues after ios18 update","My iphone15 is having many bugs like delay response lagging issue it never happened before is anyone else facing same issue",reddit,-1
1565,"Iphone 15","What is happening to my brand new iphone 15 display PLEASE WATCH THIS LINK"," ",reddit,0
1566,"Iphone 15","Does iPhone15 pro max have better reception than iPhone 15","My Company has made the switch from android to apple Im in a poor reception area my old Samsung s21 was Ok and I was able to make calls aside from a short stretch of road near my house With the iPhone 15 Im struggling with calls up to a kilometre away fro",reddit,-1
1567,"Iphone 15","can someone tell me why my phones back camera always vibrates and fucks up iphone 15 user ","every time i use my back camera mainly on snap and instagram my phone vibrates and the camera gets all wonky i wish i could show on a video but its so frustrating i bought this phone a few months ago",reddit,-1
1568,"Iphone 15","Is it safe to charge iPhone 15 with switch charger","I dont what to buy a new box to connect the new type C I already have the switch next to my bed I think its 39 watts vs 20 from the one sold at apple and 35 from Mac box",reddit,0
1569,"Iphone 15","iphone 15 pro w thunderbolt dock audio goes through thunderbolt and not headphones","I have an iphone15 pro I also have a thunderbolt dock that I use for my laptop I plugged my phone in to the dock to see what would happen The initial experience is pretty neat Keyboard mouse with AssistiveTouch enabled ethernet and my 4k monitor all just ",reddit,1
1570,"Iphone 15","Iphone 15 promax back glass","I have an iphone15 pro max and just realized the back glass is broken I have the apple upgrade plan so it includes applecare If Im going to get the new phone next month is it even worth paying to get the back glass repaired or just turn the phone in and t",reddit,-1
1571,"Iphone 15","Help for typec pendrive for iphone 15 ","Hey guys I need a type c pendrive for my iphone 15 Does every type c pendrive can run on iphone15 or there are specific ones Please recommend me some good pendrives Better if its cheap",reddit,1
1572,"Iphone 15","iphone 15 cases for kids","We just got my daughter her first phone and got an iphone15 with the new line Im probably going to purchase applecare for both of us as I just got a 15Pro for myself as well and Im a chronic phone dropper I originally got her the Otterbox Commuter case bu",reddit,1
1573,"Iphone 15","Airtel Bought a new iPhone Transferring from Nano SIM ","So I bought my parents a new iPhone 15 pro and traded in t heir old iPhone 12 in the states We knew that eSim transfer would only work in India What we didnt know that the phone you need transfer FROM also has to be eSim compatible At least this is what t",reddit,1
1574,"Iphone 15","Boya byv2 with lightning connector working with iPhone 15","Hello everyone I bought a boya byv2 with lightning connector external mic for my iphone 12 and it worked fine But I had to change my phone and got a new iphone15 which has a typec connector I ordered one USB C Male to Lightning Female Connector that works",reddit,1
1575,"Iphone 15","iphone 15 display color is warmer","Is anyone else bothered by the display color on iphone15 versus the old phones Its noticeable for white color I upgraded from iphone 11 and I really like the cooler color temperature I hate the warmer color in the display iPhone 11 vs iPhone 15",reddit,-1
1576,"Iphone 15","Couldnt find a WHITE iPhone 15 pro max instores near me to demolook at But I did find a WHITE iPhone 15 not pro or pro max I loved the aesthetic of th","TBH all I care about in this QUESTION is the visual experience of the iPhone I loved looking at the white iPhone 15 but none of the stores I went to were pushingdemoing white iPhone 15 prom maxes apparently So I guess my question comes down to If I Visual",reddit,1
1577,"Iphone 15","Why my wire earphones inear slightly perform better on Iphone 7 than Iphone15 ","Hi this might sound weird but I notice that my wire earphone in ear type sightly perform better with my 7 years old Iphone 7 than my brand new Iphone 15 plus both of them use Apples official connector that transform LightningUSBC to 35mm I felt like my Ip",reddit,1
1578,"Iphone 15","Iphone 15 pro touch issue","Today i bought two iphone15 pros and both have same issue Touch is not responding on time and i have to tap two to three times for opening an app and the typing is fucking irritating because of this issue If someone solve this issue please Dm thanks in ad",reddit,1
1579,"Iphone 15","New Iphone 15 Constantly Rebooting","Hi Everyone I just got a new iphone15 around a week ago and late last night it froze and shut down suddenly After that whenever I have it on for a few minutes it randomly restarts It also feels decently warm to the touch I have no clue what has happened a",reddit,1
1580,"Iphone 15","Iphone 15 Pro Wireless Charging not working","SOLVED it actually works but the Apple Watch wirless charger doesnt work with iphone which was the issue I have an iphone15 pro and the wireless charging isnt working Im running latest os 1711 rebooted phone twice Phone was ordered from official Apple web",reddit,-1
1581,"Iphone 15","iPhone 15 Pro Max Not Wireless Charging in CarCarplay not working","Has anyone else had this problem because of what i suspect to be an issue with the phone not laying flat on the wireless charger because of the ginormous camera lenses The other thing I noticed since upgrading from an XR is that carplay doesnt work My car",reddit,-1
1582,"Iphone 15","Need Help Anyone had experience changing iphones motherboard with Apple","Hi last time I asked you guys that when connected with wire earphonesheadphones why my brand new Iphone15 plus sound slightly different from my Iphone7 So I came to Apples official store and try if every 15plus sound the same sadly my own 15plus still sou",reddit,-1
1583,"Iphone 15","UVC HDMI Capture on iPhone 15 Pro","Hello I was wondering if it is possible to turn the iPhone 15 Pro into a display recording device via a USB capture card like the Elgato Cam Link It works perfectly on iPadOS with apps like CamX but I cannot seem to get it working at all on the iPhone Is ",reddit,1
1584,"Iphone 15","Liquid in the charging port of Iphone 15 Did I clean it up right and suggestions","So I have an iPhone 15 and I must say I know how stupid this all was lol wondering if I did the right thing in the clean up process and if anyone has any suggestions as it is sitting drying beside a fan currently Also wanted to know how if theyve made any",reddit,1
1585,"Iphone 15","Iphone noob change home screen background without changing the lock screen iphone15 pro","Hi all Recently made the switch from android to IOS iPhone 15 pro and am wanting to change my home screen background from my lock screen I want a photo from my gallery as my lock and the standard iPhone black sparkly as my home screen how the f do i do th",reddit,1
1586,"Iphone 15","How to screenshare on facetime on iphone 15 plus","I have the iphone15 plus and I was wondering how to screen share on facetime Usually on my old iphone i could swipe down from the top and there would be a screen share feature but I think dynamic island is causing that feature to be accessed somewhere els",reddit,1
1587,"Iphone 15","USB C to HDMI iPhone 15 pro","Greetings Im not a super tech guy so please bare with me I have a USB C to HDMI adapter I am able to connect my IPad Pro 6gen to an external monitor using the adapter without issues That said Im unable to do the same thing with my iPhone15 pro Ive seen se",reddit,1
1588,"Iphone 15","iPhone 15 wifi issues","Is anyone else having issues with wifi on their iphone15 Mine gets really bad reception that drops every few minutes The wifi symbol in the top right doesnt change it says there are full bars but when I try to watch a video or search something every few m",reddit,-1
1589,"Iphone 15","Should PD 18w charger work for iPhone 15","I have a wall brick charger thats labelled PD 18W Im using the original cable that iPhone15 plus came with and it is not charging the phone The charging icon on the iPhone just keeps flashing if left on it just drains the battery The same charger and cabl",reddit,1
1590,"Iphone 15","iphone 15 usbc what will really change","Like we all now that by 2024 in the eu ophone needa to be using usbc and the usbc will probably come to the iphone15 but what will really change I know it could charge faster but the iphone already has great battery life so it doesnt neccesarily need it a",reddit,1
1591,"Iphone 15","iPhone 15 color selection","Someone told me the base 15 reminds them of women panties with pastel color and the pro 15 reminds them of boxer trunks Pic for reference lol",reddit,1
1592,"Iphone 15","iPhone 15 has a smallerdowngraded sensor on its 48mp camera","Its not that the iPhone15 pro has a larger 48mp sensor Its that the iPhone 15 has a smaller sensor by comparison iPhone 15 pro and 14 pro both share the same 244 micron pixel size binned iPhone 15 has downgraded the sensor size to 20 micron pixel size bin",reddit,1
1593,"Iphone 15","Most iPhone owners see little to no value in Apple Intelligence so far",,reddit,0
1594,"Iphone 15","60Hz Display on iPhone 16 is criminal","Cant believe Apple is still keeping the 60Hz display on the regular iPhone 16 lineup I get that the high refresh rate is called ProMotion and so cant be on a nonpro phone But cmon Apple couldve easily put a 90Hz refresh rate screen on that That is deal br",reddit,1
1595,"Iphone 15","Why did my iPhone 5s take a better photo than my iPhone 15 Pro","The first photo is the one taken by my iPhone 15s back in 2015 the second photo is the same photo taken by my iPhone 15 Pro this year The color of the 5s photo is more like the actual photo But the color of the 15 Pro photo sorta has a yellow undertone If",reddit,1
1596,"Iphone 15","Are you moving from iPhone 15 Pro to 16 Pro or are you skipping ","Might be a dumb post but I was wondering what are other people who are buying new iPhones regularly going to do this year since the changes are not really that big this year At least for me 15PM user Would be nice to be able to create a poll ",reddit,1
1597,"Iphone 15","Found my lost iphone at Walmart EcoATM","Yesterday my ip15 was stolen at work by a patient It was turned off immediately and couldnt see where it was I accepted it already that its all gone so I paid off my old phone and bought a new one coz I dont have any insurance to get a replacement I went ",reddit,1
1598,"Iphone 15","Apple sent me a Mac Mini instead of an IPhone ","A couple days ago I ordered a 16 Pro after my 12 had the WiFi and Bluetooth suddenly die on it I ordered it from the Apple Store app and chose courier delivery from my local Apple Store A few hours later the courier arrives and I get the package which fee",reddit,1
1599,"Iphone 15","Benchmark scores for iPhone 16 and 15",,reddit,0
1600,"Iphone 15","iPhones have reached their peak are now a boring sequel year after year","This may garner a lot of hate in an iPhone loving community but as a fellow iPhone user myself I have to say this out Each year we hear the same old crap about exciting new phones see the same old phone being relaunched with a few MINOR tweaks Gone are th",reddit,-1
1601,"Iphone 15","Stranger came to my house claiming I stole her iPhone","Obviously I dont have it my roommates dont have it but apparently it pinged our exact address She was banging on our front door at 2 in the morning but didnt show up with the police I know findmy can be inaccurate my location showed my next door neighbors",reddit,0
1602,"Iphone 15","iPhone 16 Leaked Pics",,reddit,0
1603,"Iphone 15",Longevity,"How long do you all keep your iPhones Im wondering how long I can use the 15 if I buy one so it worth buying for me I usually buy the oldest one and keep it as long as I can I had a 5s for 5 years and now I have a 7 for 4 years now but the battery and sto",reddit,-1
1604,"Iphone 15","Xbox One and iPhone 16 Pro GPU comparison ",,reddit,0
1605,"Iphone 15","Green line in iphone 16 pro ","16 pro green line ",reddit,0
1606,"Iphone 15","My grandmas iPhone 13 Ive never seen screen burn in this bad on a phone",,reddit,0
1607,"Iphone 15","How long would new iphone15 last for remain usable","Hi all Im considering buying iphone 15 with clicks qwerty keyboard case but concerned that anecdotal evidence implies that iphones do not last very long and the case would be useless with any other model How long does a new model stay usable ie fastrespon",reddit,0
1608,"Iphone 15","Who else remembers when the iphone Home Screen could be rotated sideways or upside down ","I was going through some old pictures and found some when I got my iPhone 6 In the beginning you could rotate the Home Screen sideways or upside down It was a real pain in the butt when youd pull your phone out of your pocket and it was upside down with t",reddit,-1
1609,"Iphone 15","Opinion on iPhone 16 having 60 hz","Do you think apple is being stubborn or is there so other opinions you have",reddit,-1
1610,"Iphone 15","I think a thief put my iPhone in the EcoATM at Walmart ",,reddit,0
1611,"Iphone 15","iPhone15 Plus Review","I just got my iPhone15 Plus and been using it for 3 days already As a curious person What YouTube channel or video can I watch regarding some reviews and pros and cons of iPhone15 Plus I want to know some perks and some additional features to the 15 Plus ",reddit,1
1612,"Iphone 15","iPhone 16 Touch Unresponsive Issue","If ones skin accidentally touches the area next to the new camera control button first the whole screen becomes unresponsive until released except for the home bar This is the only area that causes the issue Test it yourself tap and hold the highlighted a",reddit,1
1613,"Iphone 15","2 months old iPhone 15 got this bulge It dies randomly ","Why this happened ",reddit,0
1614,"Iphone 15","iPhone 15 stolen this is spam right","Phone pick pocketed Sat night at bar in LA Got this text to my computer via iCloud on Monday I have tried to erase remotely but cant since they wont connect to WiFi on my phone long enough They briefly connected when sending this message Tracked location ",reddit,1
1615,"Iphone 15","Apple announced iPhone 16 event for September 9th",,reddit,0
1616,"Iphone 15","Received an email from Tim Apple about a photo I took on an iPhone","His email is in the last photo if you would like to send him some fan email He reportedly wakes up and reads them",reddit,1
1617,"Iphone 15","Transfer question","I broke my iPhone 14 and it took me a month to pay off the repair fees My plan was to pay for it and sell it iPhone 14 has sentimental photos not backed onto iCloud Drive In the time it was getting repaired I was approved for a new iphone15 and got one wi",reddit,1
1618,"Iphone 15","Apple unveils iPhone 16 Pro new design longer battery life Camera Control button more",,reddit,0
1619,"Iphone 15","Temperature of my iPhone 15 Pro Max while on the phone for 5 mins","So I have noticed with my phone that it gets particularly hot only when I am on a phone call Ive heard reports of people having abnormally hot iPhone 15 pros but no one documenting the temperature so Ill just leave this here It gets so hot that Im afraid ",reddit,-1
1620,"Iphone 15","iPhone 14 Pro cameras ruined by lasers at a party","Hi all I was at a party last night and the DJ had a laser light of some kind whilst filming a friend dressed as ziggy stardust and playing an inflatable guitar I noticed the image went all grainy and pinkishpurplish colour I immediately stopped recording ",reddit,1
1621,"Iphone 15","Found a lost iPhone and owner isnt responding","Currently in Guatemala I found an iPhone while here and made different effort to try and reach to owner I finally got the phone number linked to the SIM card and messaged it I can see that the messages are read but Im getting no answer which is super conf",reddit,-1
1622,"Iphone 15","App switcher list of open apps iphone15","Hi all What are available options to get list of open apps app switcher on iphone 15 Swipe up from the bottom of the screen then pause in the center of the screen doesnt work reliably and its very frustrating",reddit,-1
1623,"Iphone 15","iPhone 15 screen burn in after 3 weeks",,reddit,0
1624,"Iphone 15","Just realized the iPhone 16 and 16 Pro wallpapers subtly represent their camera setups ",,reddit,0
1625,"Iphone 15","An iPhone supposedly survived fall from airplane",,reddit,0
1626,"Iphone 15","Best color on an iPhone yet Ultramarine iPhone 16 ",,reddit,0
1627,"Iphone 15","Woke up to a smell of burning plastic this morning Turns out my iPhone 15 Pro melted overnight","Went to the Apple Store as soon as they opened at 10AM They replaced it on the spot and said theyve never seen it before Has this happened to anybody else",reddit,0
1628,"Iphone 15","iPhone alarm didnt go off","Ive got an iPhone alarm for 1046 PM and it has not gone off it has being 3 minutes since proposed alarm was meant to go off but it didnt go off what is wrong with it",reddit,-1
1629,"Iphone 15","Stolen iPhone","Just for my peace of mind these texts are total BS right My phone was stolen on New Years and I used my find my iPhone to erase it The erase is still pending I changed my Apple ID password and got a new phone Theyre just trying to get me to take my Apple ",reddit,1
1630,"Iphone 15","I designed this MagSafe stand for my iPhone inspired by the classic G4 iMac design ",,reddit,0
1631,"Iphone 15","Would anyone else love a dark red iPhone Pro Max ","I have been hoping for years now that Apple would release a pro model in a red color except they havent ",reddit,1
1632,"Iphone 15","I really hope iPhone 16 Pro lineup has this awesome coating ",,reddit,0
1633,"Iphone 15","threats after my iphone was stolen","i had an iphone stolen last october 2022 and then again on august 5 i reported the phones missing and remotely erased them they both still say erase pending as of a few days ago ive been getting messages from various phone numbers telling me to remove the",reddit,-1
1634,"Iphone 15","What is a little known or hidden iPhone feature that you use every day","As the title says I want to hear about awesome features that anyone can use but arent very obvious or require a little bit of digging to find them This could be in iOS 17 or 18 if youre on beta",reddit,1
1635,"Iphone 15","Do you think the camera control button is gonna stick around on future iPhone models ",Title,reddit,0
1636,"Iphone 15","Bizarre iPhone 16 pro max pricing","Pricing of iphone 16 pm at local Walmart seems a little weird I wonder if its a mistake ",reddit,-1
1637,"Iphone 15","What are your opinions on the regular iPhone 16s new camera bump design",I,reddit,0
1638,"Iphone 15","iPhone 15 Alarms Failing To Go Off Is This Happening To Anyone Else","Has anyone else had issues with their alarms failing to go off in the morning like this I usually set several sequential alarms as you can see in this picture Only my alarm for 645 AM actually sounded I woke up to find that my earlier alarms had all remai",reddit,-1
1639,"Iphone 15","What do you think is peak iPhone design","I have heard many people saying that iPhone design is past its peak and that something around the post notch era was best I dont personally agree with this but curious as to what the general consensus is My personal choice would be the 13 pro max in sierr",reddit,1
1640,"Iphone 15","I found an iPhone 15 max","I was riding my moped and it was laying in the street It looked like it had been run over a couple of times but when I got it home I was surprised to find that it was only the screen protector that was cracked and the case protected the rest of the phone ",reddit,1
1641,"Iphone 15","Apple sued by Biden administration and 16 state and district attorneys over alleged iPhone monopoly power","Among the suits allegations Apple prevents the successful deployment of what the DOJ calls super apps that would make it easier for consumers to switch between smartphone platforms Apple blocks the development of cloudstreaming apps that would allow for h",reddit,1
1642,"Iphone 15","Galaxy Watch 6 to iPhone15","Hey guys Mom bought a Samsung Galaxy S24 and it comes with Galaxy Watch 6 She gave me the watch Does the new Galaxy Watch 6 works with iPhone 15 Any thoughts Thank you",reddit,1
1643,"Iphone 15","Whats your opinion on new iPhone SE 4 concept","Its just smashing every other iPhone for the next and next next years ",reddit,0
1644,"Iphone 15","After unlocking with face id my iphone15 asks passcode","Sometimes when my iphone 15 and ipad air 5 asks passcode even i unlocked it with my face id already Is it bug ",reddit,0
1645,"Iphone 15","Apple working to fix alarming iPhone issue iPhone alarms not sounding",,reddit,0
1646,"Iphone 15","Im not sure what happened to the iPhone of my sister","She brought her phone and it says this Translation is Lost iPhone Block number F014 Password changed To unlock text to some telegram number Reset wont help Its quite obvious that its been hacked and scammers logged in with another iCloud So my question ho",reddit,-1
1647,"Iphone 15","Anyone know how to bypass this its an iPhone 4 and I aint waiting 43 years","Please help",reddit,1
1648,"Iphone 15","iPhone 15 this lens flare is ridiculous",,reddit,0
1649,"Iphone 15","How do you feel about USBC on iPhones over a year after it was introduced","Well exactly as in the title Id love to know your thoughts about it",reddit,1
1650,"Iphone 15","Stolen iPhone 15 pro","I went to Nashville around thanksgiving After leaving Jason Aldeans bar on Broadway at 2 am I realized it was missing from my pocket I put it on lost mode through Find My I got a strange message via iMessage with directions on how to forget the device Now",reddit,-1
1651,"Iphone 15","This is what the future iPhone 16 and iPhone 16 Pro Max will look like","What do you think about new camera design",reddit,0
1652,"Iphone 15","Refurbished iphone 14 plus is the screen supposed to be this pink","Its really throwing me off The screen is pink tinged and gives me a headache I much prefer my iPhone 12 screen tone that is easier to look at Are all iphone 14s like this or is it a defect",reddit,1
1653,"Iphone 15","60hzs display issues","Iphone1515 plus users does the 60hzs display bother you Im on the brink of buying it but coming from a 120hzs Android its going to be a downgrade But I wanna know how intolerble would that be I mean is it going to be as jittery as 2012 smartphones which a",reddit,0
1654,"Iphone 15","Hair under camera lense on iPhone 16 Pro Max","Somehow theres a hair under my iPhone 16 Pro Max lense I have had the phone since release day and it was not there when I got it Yes its definitely a hair and not a scratch I tried cleaning the lense its still there If I hit the side of the phone the hair",reddit,1
1655,"Iphone 15","The iPhone reviewers saying the camera button is not good are wrong ","Im at a music festival today Have been tasked with making a promo video My 16 pro max arrived Friday I took a huge gamble and didnt bring my Canon 5D and thought Id push the boat out and film the whole thing iPhone The button takes a tiny tiny bit of time",reddit,1
1656,"Iphone 15","Here is the new iPhone Lineup",,reddit,0
1657,"Iphone 15","iPhone owners say the latest iOS update is resurfacing deleted nudes",,reddit,0
1658,"Iphone 15","iPhone stolen in Japan and is now in Nigeria","I was studying abroad in Japan and my phone was taken out of my pocket in Shinjuku Tokyo in a very busy area without me noticing Im now back in the United States but since returning my iPhone is now in Nigeria Ive never even been to Africa in my life Quit",reddit,1
1659,"Iphone 15","Whats this black spot on my iPhone screen ",,reddit,0
1660,"Iphone 15","Been rocking a naked iPhone for a few years I guess my luck ran out",,reddit,0
1661,"Iphone 15","Apple Announces New Camera App Called Final Cut Camera for iPhone Users",,reddit,0
